{
  "ActionsRequired": "example-value",
  "AuthenticationStrategy": "example-value",
  "AutoMinorVersionUpgrade": "example-value",
  "BrokerArn": "arn:aws:service:us-east-1:123456789012:resource/example",
  "BrokerId": "id-abc123",
  "BrokerInstances": "example-value",
  "BrokerName": "example-resource",
  "BrokerState": "example-value",
  "Configurations": "example-value",
  "Created": "example-value",
  "DeploymentMode": "example-value",
  "EncryptionOptions": "example-value",
  "EngineType": "STANDARD",
  "EngineVersion": "example-value",
  "HostInstanceType": "STANDARD",
  "LdapServerMetadata": "example-value",
  "Logs": "example-value",
  "MaintenanceWindowStartTime": "example-value",
  "PendingAuthenticationStrategy": "example-value",
  "PendingEngineVersion": "example-value",
  "PendingHostInstanceType": "STANDARD",
  "PendingLdapServerMetadata": "example-value",
  "PendingSecurityGroups": "example-value",
  "PubliclyAccessible": "example-value",
  "SecurityGroups": "example-value",
  "StorageType": "STANDARD",
  "SubnetIds": "id-abc123",
  "Tags": "example-value",
  "Users": "example-value"
}